job_title,company_name,location,remote_option,tech_stack,experience_years,salary_min,salary_max,currency
Middle/ Senior PHP Dev ( AI/ MVC/ Laravel/ JavaScript ),Vision Vietnam,Ha Noi,onsite,"PHP, GitHub, Laravel, MVC, AI, JavaScript",,,,
"Full-stack Web (Nuxt.js / NextJS, NodeJS, Laravel)",CÔNG TY TNHH JV-IT TECHS,Ho Chi Minh,hybrid,"Fullstack, Laravel, NodeJS, NextJS, Nuxt.js",3 years,,,
"Applied AI Engineer (Junior - Middle, English)",Spartan Dev Inc,Ho Chi Minh - Da Nang,hybrid,"AI, Algorithms, Generative AI, Fullstack, LLM, English",1+ years,,,
"Java Deverloper (JavaScript, Spring Boot, Oracle)","ADVANCE TECH .,JSC",Ha Noi,onsite,"Java, JQuery, Oracle, Spring Boot, JavaScript, OOP",2 years,,,
Manual Tester,"ADVANCE TECH .,JSC",Ha Noi,onsite,"Tester, QA QC, SQL",02 years,,,
Cybersecurity Engineer (Security/API/Networking),Phu Hung Securities (PHS),Ho Chi Minh,onsite,"Cybersecurity, Database, English, Web Application Firewall, API",3 years,,,
Product Delivery Manager,Phu Hung Securities (PHS),Ho Chi Minh,onsite,"Project Management, English, Jira, Scrum, Business Analysis",5 years,,,
Web Application Developer (React/Typescript/JavaScript),Công ty cổ phần Everpia,Hung Yen,onsite,"JavaScript, Git, API, CSS 3, HTML5, TypeScript",5 years,,,
"Business Analyst (UML, Figma)",Công ty Cổ phần Công nghệ & Giáo dục Chip Chip,Ha Noi,onsite,"Business Analysis, Prototyping, UI-UX, Figma, UML",3-5 years,,,
"Product Owner (Figma, User Story, Product Roadmap)",Airdata Technology,Ha Noi,onsite,"Product Owner, Mockups, Product roadmap, User story",3-4 years,,,
Game Tester (Female),Gamee Studio,Ha Noi,onsite,"Tester, Games",1 years,,,
Junior Fullstack Python Developer (Internal Tools),Công Ty Cổ Phần Dịch Vụ Fincon Global,Ha Noi,onsite,"Fullstack, Database, FastAPI, Docker, Python, MySQL",1-2 years,,,
