job_title,company_name,location,remote_option,tech_stack,experience_years,salary_min,salary_max,currency
Senior Cloud Security Engineer,CTCP SÀN GIAO DỊCH TÀI SẢN MÃ HÓA VIỆT NAM THỊNH VƯỢNG (CAEX),Ha Noi,onsite,"Cloud Security, Golang, DevSecOps, Container Security",,,,
.NET Developer,Simpson Strong-Tie Vietnam,Ho Chi Minh,hybrid,".NET, English, .Net Core, C#",3+ years,,,
Senior Full-stack Developer (SAP Hybris),Simpson Strong-Tie Vietnam,Ho Chi Minh,remote,"Java, Microservices, ReactJS, Spring Boot, SAP",5 years,,,
AI Software Engineer (Python/Go/C/C++ & AI Agents),MB Bank,Ha Noi,onsite,"Python, FastAPI, Docker, Microservices Architecture, Golang",,,,
Agentic Engineer (Python/Go/C/C++ Backend & AI Agents),MB Bank,Ha Noi,onsite,"Python, TensorFlow, Flask, FastAPI, Microservices, C++",,,,
(HOLT.17)Senior AI Engineer (Computer Vision/NPL/LLM),MB Bank,Ha Noi,onsite,"AI, TensorFlow, PyTorch, Microservices, C++, Python",2 years,,,
(HOLT.16) Senior AI Expert (Machine Learning),MB Bank,Ha Noi,onsite,"AI, LLM, Deep Learning, Machine Learning, Computer Vision",5 years,,,
"(HOLT.15) AI Expert (Deep Learning, Machine Learning)",MB Bank,Ha Noi,onsite,"AI, LLM, Machine Learning, Computer Vision, NLP",3 years,,,
(HO26.85) Trưởng phòng Công nghệ Thị giác Máy tính,MB Bank,Ha Noi,onsite,"Computer Vision, Deep Learning, TensorFlow, PyTorch",5 years,,,
(HO26.84) CV Phát triển khoa học dữ liệu-Data Scientist,MB Bank,Ha Noi,onsite,"Big Data, AI, Data Science",1 years,,,
VAI_Senior Solution Architect,Viettel Group,Ha Noi,onsite,"Software Architecture, Design, Team Management, JavaScript",5 years,,,
"System Engineer (JavaScript, APIs, AWS, Azure, GCP)",AI AVATAR,Ha Noi,onsite,"System Admin, GCP, Azure, AWS, API, JavaScript",,,,
Senior Business Analyst & Technical Writer (AI-First),NTP-Tech,Ha Noi,onsite,"Business Analysis, Product Owner, English, AI",7+ years,,,
VAI_Quality Assurance Engineer,Viettel Group,Ha Noi,onsite,"QA QC, Project Management, Product Management",2 years,,,
VAI_Fullstack Engineer,Viettel Group,Ha Noi,onsite,"Software Architecture, Scala, Team Management, JavaScript",2 years,,,
"Cloud Solution Architect (AWS) (Senior, Junior)",MEGAZONE,Ha Noi,onsite,"Solution Architecture, System Architecture, Cloud-native Architecture",1-5 years,,,
AI Engineer,Dirox,Ho Chi Minh,hybrid,"AI, Python, Docker, LLM, Generative AI",5+ years,,,
AI Architecture Lead (SA),VinSmart Future,Ha Noi,onsite,"Python, AI, AWS, DevOps, Software Architecture",5+ years,,,
"DevSecOps (Jenkins, gitlab)",ABBANK,Ha Noi,onsite,"DevSecOps, GitLab, Jenkins, Networking, Security, DevOps",05 years,,,
Game Client Developer (Cocos Creator/Unity/C#),RGP Software Processing,Ho Chi Minh,onsite,"Games, Spin, Cocos Creator, Cocos2d-x, C#, Unity",3 years,,,
Backend Developer (Java/ WebSocket/ Redis/ Kafka),RGP Software Processing,Ho Chi Minh,onsite,"Java, Redis, MySQL, Kafka, Spring",5 years,,,
Mid/Sr Java Developer (English Required) - Up to 3200$,"Rakuten Fintech Vietnam Co., Ltd.",Ho Chi Minh,onsite,"Java, Unit test, Spring Boot, Spring, SQL, English",5+ years,,,
"AI Developer (Python, C#, Git, JavaScript, Azure)",SAVILLS VIETNAM,Ho Chi Minh,onsite,"AI, Azure, JavaScript, Git, C#, Python",,,,
Enterprise Architecture (Quản Trị Kiến Trúc),ABBANK,Ha Noi,onsite,"Solution Architecture, Leadership, Software Architecture",5 years,,,
"Senior Fullstack Developer (ReactJS, NodeJS)",Template.net,Ho Chi Minh,onsite,"JavaScript, Product Management, Generative AI, NodeJS",5+ years,,,
Android Developer (Middle - Senior),Ingenico Vietnam,Ha Noi,onsite,"Android, Agile",8 years,,,
"CVCC Quản trị dữ liệu (Data Governance, SQL, R )-K.CNTT",PVcomBank,Ha Noi,onsite,"Python, Data Quality Tools, Data Lineage, Database, PL/SQL",3 years,,,
CVCC Phát triển hệ thống Quản trị tài chính - K.CNTT,PVcomBank,Ha Noi,onsite,"PL/SQL, SQL, Business Intelligence, Business Analysis, Scrum",3 years,,,
Korean Bridge Software Engineer,LG CNS Việt Nam,Ha Noi,onsite,"Bridge Engineer, Korean, IT Communication/Translation",1 years,,,
Application Architect,LG CNS Việt Nam,Ha Noi,onsite,"Microservices Architecture, Agile, Networking, Linux, GCP",7+ years,,,
Senior Machine Learning Engineer (Open for Team Lead),Home Credit Vietnam,Ho Chi Minh,onsite,"Machine Learning, English, NLP, LLM, Python",3+ years,,,
"Senior DevSecOps Engineer –Logistics Platform (AWS,SQL)",Smartlog,Ho Chi Minh,onsite,"AWS, OWASP, Git, DNS Security, Docker, SQL",4+ years,,,
Technical Lead (Ruby/Java/NodeJS/PHP),RAKSUL Vietnam,Ho Chi Minh,hybrid,"Ruby on Rails, Java, Ruby, PHP, NodeJS, English",8 years,,,
"Junior Power Platform Dev(UI/UX, .NET)(Strong English)",Wilmar CLV (Cambodia Laos Vietnam),Ho Chi Minh,onsite,"UI-UX, HTML, JavaScript, ASP.NET, C#, .NET",,,,
".NET Developer (C#, ASP.NET,...)(strong English)",Wilmar CLV (Cambodia Laos Vietnam),Ho Chi Minh,onsite,".NET, API, SQL, MVC, ASP.NET, C#",,,,
"AI Engineer (Python, Microservices, Docker)",ABBANK,Ha Noi,onsite,"AI, Docker, Microservices, Python",5 years,,,
PHP Team Leader (Laravel/ SQL),ORO Vietnam,Ho Chi Minh,onsite,"PHP, Leadership, Laravel, Database, Symfony, SQL",,,,
"Senior Analyst, Operations FP&A (English)",Aviron,Ho Chi Minh,onsite,"Predictive Analytics, Strategy planning, English, Power BI",7 years,,,
Technical Project Manager (English),Terralogic,Ho Chi Minh,onsite,"Team Management, Stakeholder management, Product Management",8 years,,,
"System Administrator (Windows Server, Linux)",Công ty cổ phần Tập đoàn Công nghệ Quảng Ích (QIG),Ha Noi,onsite,"System Admin, Cisco, Firewall, VMware, Linux",2 years,,,
Senior Backend Engineer (Nodejs),FireGroup,Ho Chi Minh,onsite,"NodeJS, PostgreSql, MySQL, OOP, Redis, MongoDB",5+ years,,,
[Global Market] Database Developer (SQL),RIKKEISOFT,Ha Noi,onsite,"NoSQL, SQL, English",2+ years,,,
Senior Golang Developer,CÔNG TY TNHH FINAN,Ho Chi Minh,onsite,"Golang, Microservices, Kubernetes, Docker, Redis",3+ years,,,
Senior QA/QC Engineer,CÔNG TY TNHH FINAN,Ho Chi Minh,onsite,"QA QC, Selenium, Python, Java, Postman",3+ years,,,
Data Engineer (Middle),CÔNG TY TNHH FINAN,Ho Chi Minh,onsite,"Python, MongoDB, PostgreSql, AI, SQL",5+ years,,,
Senior Java AI Backend Engineer (English),HRS Group,Ho Chi Minh,hybrid,"Java, English, AWS, Python, AI",,,,
Technical  Animator (Avatar Motion & Unity Integration),Optimizer Việt Nam,Ho Chi Minh,onsite,"Unity, Blender, Design",2 years,,,
Backend Engineer (Go/Java),Trusting Social,Ho Chi Minh,onsite,"Golang, CI/CD, Java, Database, Security, Microservices",5+ years,,,
"(Senior) Mobile Developer (iOS, Android)",GFT Technologies Vietnam,Ha Noi - Ho Chi Minh,hybrid,"iOS, Java, Swift, Kotlin, Android, English",5+ years,,,
Engineering Director (Open for Expat),"MONEY FORWARD VIETNAM CO.,LTD",Ho Chi Minh,hybrid,"Project Management, Team Management, English",10+ years,,,
Technical Lead (Go/Java/Kotlin/TypeScript/Python),"MONEY FORWARD VIETNAM CO.,LTD",Ho Chi Minh,hybrid,"Golang, Python, TypeScript, Kotlin, Java",5+ years,,,
"Software Engineer II (C#, dotnet,Java)",Motorola Solutions,Ho Chi Minh,onsite,"C#, Golang, Java, .NET",3 years,,,
Project Manager,MOR,Ho Chi Minh - Ha Noi,onsite,"Project Management, Agile, English",3+ years,,,
CV Báo cáo tuân thủ - Compliance Reporting Officer,MB Bank,Ha Noi,onsite,"SQL, Power BI, Data Privacy / Compliance, Oracle, Tableau",1 years,,,
Data Quality Management Specialist,MB Bank,Ha Noi,onsite,"Data Privacy / Compliance, Cloud Security, Data Quality Tools",1 years,,,
Frontend Engineer,Vulcan Labs,Ho Chi Minh,onsite,"TypeScript, Tailwind, NextJS, ReactJS",3+ years,,,
"Mid/Sr/Lead .NET Backend Developer (C#, SQL)",NTQ Solution,Ha Noi,onsite,".NET, Team Management, SQL, English, C#, Azure",,,,
"Infrastructure Architecture Expert (Cloud, On-premise)",ABBANK,Ha Noi,onsite,"Cloud, DevOps, System Admin, Software Architecture, Security",10-15 years,,,
[All level] Network Administrator (Cisco/HP/Juniper),MB Bank,Ha Noi,onsite,"Networking, PCI DSS, Juniper, Cisco, System Admin",01 years,,,
Chuyên viên Quản lý Hạ tầng Trung tâm Dữ liệu,MB Bank,Ha Noi,onsite,"Linux, MySQL, Security, Penetration Testing, SQL",,,,
Senior Bridge Engineer - BrSE (Japanese N2+),"ANDPAD VietNam Co., Ltd",Ho Chi Minh - Ha Noi,hybrid,"Bridge Engineer, Japanese, Project Management, QA QC",3 years,,,
"Senior iOS Engineer (Swift, MVVM, MVC)",EPAM Vietnam,Ho Chi Minh - Ha Noi,hybrid,"iOS, OOP, AI, MVC, Swift, MVVM",,,,
Data Engineer (Java/Python/Scala/Hadoop/Kafka),Giao Hàng Tiết Kiệm,Ha Noi,onsite,"Data Engineer, Hadoop, Big Data, Scala, Python, Java",3 years,,,
"Senior Java Engineer (Spring Boot, Microservices, SQL)",EPAM Vietnam,Ho Chi Minh - Ha Noi,hybrid,"Java, CI/CD, SOLID Principles, Spring Boot, Microservices",5 years,,,
Java Spring Boot (20-40 Mil),Nitori Digital Base Vietnam,Ha Noi,hybrid,"Java, JavaScript, Angular, English, Spring Boot",03 years,,,
[HCM] Salesforce Developer (All level) | Up to 55M VND,Hybrid Technologies,Ho Chi Minh,onsite,"Salesforce, CRM, JavaScript, Japanese, English",6+ years,,,
"Mobile App Developer (.NET, Xamarin, iOS/Android, AI)",Song Technologies LLC,Ho Chi Minh,onsite,".NET, English, Xamarin, Android, iOS, AI",3 years,,,
Technical Architect,HSC,Ho Chi Minh,onsite,"Team Management, Software Architecture, Leadership",10 years,,,
Frontend Developer (Shopify/Wordpress Developer),SOLIS LAB,Ha Noi,onsite,"JavaScript, HTML, VueJS, ReactJS, TypeScript, CSS",,,,
Security Architect / Senior Security Engineer,Prime Tech Solution,Ho Chi Minh,hybrid,"Cybersecurity, Zero Trust Architecture, Cryptography, Security",,,,
Data Engineer Leader,Fullerton Health,Ho Chi Minh,onsite,"Data Engineer, AI, Data Privacy / Compliance, Data Warehousing",12+ years,,,
Software Asset Management Specalist,Renesas Design Vietnam,Ho Chi Minh,hybrid,"Scrum, Team Management",2 years,,,
"Manual QA Engineer/Tester (QA QC, English, Insurance)",FWD VTC,Ho Chi Minh,hybrid,"QA QC, Tester, Agile",2 years,,,
"Backend Technical Lead ( Storefront, C#, .NET. ASP.NET)",Crossian,Ha Noi,onsite,"C#, ASP.NET, Database, Microservices, Java, .NET",7 years,,,
GCP Cloud specialist (Japanese speaking),Capgemini Vietnam,Ho Chi Minh,onsite,"GCP, Japanese, Terraform, Cloud",5+ years,,,
Senior Application Operations (Vận hành ứng dụng),Công ty Cổ phần Thanh toán số MobiFone,Ha Noi,onsite,"DevOps, System Architecture, Splunk, CI/CD, Grafana",3 years,,,
GNSS Engineer – Android Automotive (Good English),Suntech Vina (Hợp tác cùng tập đoàn CNTT hàng đầu Ấn độ),Ha Noi,onsite,"C++, Sensor Fusion, Embedded, English, Android",,,,
Software Project Manager – Japanese OR Chinese Speaking,Bosch Global Software Technologies Company Limited,Ho Chi Minh,onsite,"Embedded, Chinese, Japanese, Embedded C",8 years,,,
Team Leader SOC/ Pentest,NGÂN HÀNG THƯƠNG MẠI TNHH MTV KỶ NGUYÊN THỊNH VƯỢNG (GPBANK),Ha Noi,onsite,"Pentest, Leadership, API, Security",10 years,,,
"Automation Tool Developer (Python, Embedded, English)",LG Electronics Development Vietnam (LGEDV),Ha Noi,onsite,"Python, Embedded, ThreadX, OOP, English",3 years,,,
[Sign-on Bonus] Project Leader/ BrSE (Japanese N2+),NEC Vietnam,Da Nang,onsite,"Bridge Engineer, Angular, Japanese IT Communication, Java",5+ years,,,
"Software Engineer (Embedded C, MCU, RTOS)",LG Electronics Development Vietnam (LGEDV),Ha Noi,onsite,"Embedded C, RTOS",2 years,,,
"R&D System Engineer (VMware, Docker, Kubernetes)",GLOBALTECH,Ho Chi Minh,onsite,"System Admin, Networking, Security, VMware, Kubernetes",2 years,,,
"Automotive Software Engineer (C++, OOP, Middleware)",LG Electronics Development Vietnam (LGEDV),Ha Noi,onsite,"C++, Middleware, Linux, OOP, Embedded",,,,
Senior Technical Product Manager (Agentic AI),Katalon,Ho Chi Minh,onsite,"AI, Product Metrics, Business Analysis, LLM, Product strategy",5+ years,,,
Application & Cloud Security Engineer,CÔNG TY CỔ PHẦN NGHIÊN CỨU PHÁT TRIỂN VÀ ỨNG DỤNG NGƯỜI MÁY ĐA NĂNG VINMOTION,Ha Noi,onsite,"Application Security, API, OWASP, Cloud Security",3+ years,,,
"IT Business Analyst (T24, banking, finance)",ABBANK,Ha Noi,onsite,"Business Analysis, Data Analysis, Jira",5 years,,,
[REMOTE] 2D Game Artist,Athena Studio,Ho Chi Minh,remote,"UI-UX, Design, Generative AI, Spine, Adobe Photoshop",4+ years,,,
[REMOTE] Game Designer,Athena Studio,Ho Chi Minh,remote,"Design, Games",5+ years,,,
QA Engineer (Automation/Manual Testing)~Up to $1500,Ewoosoft Vietnam,Ha Noi,onsite,"QA QC, English, Automation Test, Tester, AI",3+ years,,,
Data Platform Engineer,Home Credit Vietnam,Ho Chi Minh,onsite,"Machine Learning, Kubernetes, Spark, Linux, Data Engineer",3 years,,,
"Senior System Engineer (Linux, Windows Server, Cloud)",One Mount Group,Ha Noi - Ho Chi Minh,onsite,"Linux, Terraform, CI/CD, Docker, Cloud, Windows Server",3 years,,,
HTML/Wordpress developer - Japanese Company,"Abilive Vietnam Co., Ltd.",Ha Noi,onsite,"Wordpress, HTML, MySQL, PHP, JavaScript, CSS",02 years,,,
"Technical PM (Da Nang, Can Tho, Hybrid)",Dirox,Ho Chi Minh,hybrid,"Project Management, AI, Software Architecture",8+ years,,,
"Business Analyst (Da Nang, Can Tho, Hybrid)",Dirox,Ho Chi Minh,onsite,"Business Analysis, Scrum, Agile, English",5+ years,,,
"Expert/Senior Monitoring Engineer (Grafana, Prometheus)",Techcombank,Ha Noi,onsite,"DevOps, InfluxDB, Splunk, Prometheus, Grafana",3+ years,,,
Mid/Sr DevOps Engineer (Terraform/Kubernetes),Saritasa,Ho Chi Minh,onsite,"DevOps, Terraform, Kubernetes, Networking, PowerShell",3 years,,,
Product Owner,MB Life,Ha Noi,onsite,"Product Owner, Product strategy, Agile, Stakeholder management",02 years,,,
Middle System Admin,Thai Son Soft,Ha Noi,onsite,"System Admin, Networking, Windows, Linux, IT Support",2-3 years,,,
Senior Delivery Lead,Techcombank,Ha Noi,onsite,"Project Management, English, ITIL Foundation",8 years,,,
"Senior Game Designer (Puzzle, Board Games)",ANTADA,Ho Chi Minh,onsite,"Games, Design",3 years,,,
Senior Database Administrator,NAB Innovation Centre Vietnam,Ho Chi Minh,hybrid,"DBA, SQL, PostgreSql, Database, Cloud, Oracle",6-8 years,,,
Principal QC Engineer,Titan DMS,Ho Chi Minh,hybrid,"Team Management, Agile, QA QC, English, CI/CD",7+ years,,,
Senior Android Developer (Kotlin / Java),Sigma Solutions,Ha Noi,onsite,"Android, Mobile Apps, MVVM, OOP, Java, Kotlin",3+ years,,,
"Enterprise Architect (Fintech, TOGAF, Cloud)",Mcredit - Công ty Tài chính TNHH MB Shinsei,Ha Noi,onsite,"Enterprise Architecture, .NET, Spring Boot",8 years,,,
"Senior iOS Developer (Swift, Objective-C, OOP)",Sigma Solutions,Ha Noi,onsite,"iOS, Mobile Apps, MVC, OOP, Objective C, Swift",3+ years,,,
Fullstack Software Engineer,Talosix,Ho Chi Minh,hybrid,"Fullstack, Python, SQL, Java, NodeJS, JavaScript",3+ years,,,
Mid/ Senior Game developer ( Cocos Creator ),BinarixTech,Ho Chi Minh,onsite,"Games, JavaScript, C#, HTML5, Cocos Creator, TypeScript",,,,
Senior QC Engineer,Vietlink,Ho Chi Minh,onsite,"JavaScript, Python",7 years,,,
Delivery Leader/Delivery Manager,Capgemini Vietnam,Ho Chi Minh,onsite,"Project Management, Leadership, Java, Risk Management",5+ years,,,
Big Data Admin (Kafka/Docker/Data Warehousing/Spark),Giao Hàng Tiết Kiệm,Ha Noi,onsite,"Big Data, Data Warehousing, Docker, MySQL, Kafka",1 years,,,
Fullstack Developer (Python/VueJS or Angular - 10Y EXP),LAVEGA,Da Nang,onsite,"Python, PostgreSql, MongoDB, FastAPI, English, VueJS",10 years,,,
.NET Developer (Mortgage Systems),Topicus Vietnam,Ho Chi Minh,hybrid,".NET, English",3 years,,,
"Remote Mobile App Developer (Java, Kotlin, Android)","Solventus, LLC",Da Nang - Ha Noi - Ho Chi Minh,remote,"Android, Application Security, Java, API, Android studio",3+ years,,,
"Remote Fullstack Developer(TypeScript, ReactJS, NodeJS)","Solventus, LLC",Da Nang - Ha Noi - Ho Chi Minh,remote,"TypeScript, NextJS, AWS, NodeJS, PostgreSql, ReactJS",3+ years,,,
Principal/Lead Backend Engineer (Java/Kotlin),"MONEY FORWARD VIETNAM CO.,LTD",Ho Chi Minh,hybrid,"Java, English, AWS, Kotlin, Software Architecture",8 years,,,
Cybersecurity Operations Manager - SOC Manager,AURIFY,Ho Chi Minh,hybrid,"Cybersecurity, DevSecOps, Vulnerability Management, Linux",5 years,,,
Chuyên viên Phát triển ứng dụng (Java Developer),SACOMBANK,Ho Chi Minh,onsite,"Java, Windows Server, API, Linux, Microservices, Spring",02 years,,,
"Chuyên viên Phát triển MIS (Data Analyst/ Engineer, BI)",SACOMBANK,Ho Chi Minh,onsite,"Data Analysis, PL/SQL, Oracle, Data modeling, ETL",1 years,,,
Chuyên viên QC (Automation Tester/ QA QC),SACOMBANK,Ho Chi Minh,onsite,"Automation Test, Tester, QA QC, English",03 years,,,
"QA Architect (QA QC, Tester, Playwright, Selenium)",MEALSUITE,Ho Chi Minh,onsite,"Tester, Playwright, Automation Test, Selenium, QA QC",,,,
Junior/Senior Cloud Infrastructure Engineer,GLOBALTECH,Ho Chi Minh,onsite,"OpenStack, Ansible, Prometheus, Kubernetes, Python",2 years,,,
Requirements Management Tools DevOps Engineer,Renesas Design Vietnam,Ho Chi Minh,hybrid,"HP ALM, DevOps, 3ds Max",,,,
Senior Application Security/ Threat Modelling,Dai-ichi Life Việt Nam,Ho Chi Minh,onsite,"Application Security, Microservices, API, DevSecOps",4+ years,,,
Project Team leader/Project Manager (JLPT N2),"NTT e-MOI.,JSC",Ha Noi,onsite,"Project Management, Japanese",3-15 years,,,
Network Operation Engineer,LG CNS Việt Nam,Ha Noi,onsite,"CompTIA Network+, Networking, Python, Cisco, Cloud, AWS",,,,
(HN/HCM) Senior Frontend Engineer (JavaScript (ES6+)),One Mount Group,Ho Chi Minh - Ha Noi,onsite,"JavaScript, TypeScript",4+ years,,,
AI Scientist - Enterprise AI Research,Base Inc.,Ha Noi,onsite,"AI, Machine Learning, Deep Learning",,,,
"(Product - Focused) AI Engineer (Python, LLM, AI/ML)",Base Inc.,Ha Noi,onsite,"AI, LLM, Python, Machine Learning",3+ years,,,
Systems Administrator (Linux/Cloud) - ID2694,VPBank,Ha Noi,onsite,"System Admin, Cloud, AWS, Linux, Windows Server",,,,
Portfolio Management (Mảng hạ tầng) - ID2698,VPBank,Ha Noi,onsite,"Project Management, Change Management, ITIL Foundation",3 years,,,
Server Operator (Vận hành máy chủ) – ID2702,VPBank,Ha Noi,onsite,"Windows Server, Python, VMware, Linux",,,,
(HN/HCM) Senior Product Owner (Data Platform),One Mount Group,Ha Noi - Ho Chi Minh,onsite,"Product Owner, English",4+ years,,,
(HCM) Senior Data Engineer,One Mount Group,Ho Chi Minh,onsite,"Data Engineer, Data-driven, Databricks, Database",4+ years,,,
Kỹ sư phân tích nghiệp vụ (IT Business Analyst) - VIC,Viettel Group,Ha Noi,onsite,"Business Analysis, SRS, AI, BRD, English",2 years,,,
"Data Scientist Expert (Python, Cloud, AI/ML) – ID2645",VPBank,Ha Noi,onsite,"Data Science, AWS, Pandas, PyTorch, Python, Generative AI",7 years,,,
"Data Engineer (Java, Kafka, Spark, Flink, Hadoop)",Tổng công ty Tân Cảng Sài Gòn (Saigon NewPort Corporation),Ho Chi Minh,onsite,"Data Engineer, Spark, Java, Data Warehousing, Big Data",,,,
"Senior Data Operations Engineer (Oracle, SQL) - ID2371",VPBank,Ha Noi,onsite,"Data Engineer, Business Intelligence, Data Warehousing",,,,
"Java Developer (Spring Boot, Microservices) – ID2686",VPBank,Ha Noi,onsite,"Java, Kafka, Windows, Linux, AWS, Spring Boot",3 years,,,
Salesforce Developer,LG CNS Việt Nam,Ha Noi,onsite,"ERP, Salesforce",3+ years,,,
System Engineer ( Linux/Windows Server),VTC Online,Ha Noi,onsite,"System Admin, Networking, System Architecture, Windows Server",3 years,,,
Senior IOS developer (Good English),Outcubator,Ha Noi,onsite,"Swift, Objective C, iOS",5+ years,,,
"Front End Developer (Reactjs, Good English)",Outcubator,Ha Noi,onsite,"ReactJS, VueJS, CSS 3, HTML5",4 years,,,
Security Operations Center Analyst (IT Support),Mắt Bão BPO,Ho Chi Minh,onsite,"IT Support, Cybersecurity, Security",2 years,,,
[Telecom] System Admin,Huawei,Ha Noi,onsite,"Database, English",1+ years,,,
Quản trị hệ thống Cơ sở Dữ liệu (DBA - Database Admin),SACOMBANK,Ho Chi Minh,onsite,"System Admin, Cloud, Linux, Microsoft SQL Server, Oracle",03 years,,,
CV Quản Trị Hệ Thống/ System Admin (Unix/ Linux),SACOMBANK,Ho Chi Minh,onsite,"System Admin, System Architecture, Microsoft SQL Server, Unix",2 years,,,
Frontend ReactJS Developer,LG CNS Việt Nam,Ha Noi,onsite,"ReactJS, JavaScript",4+ years,,,
Information Security & Cyber Resiliance Officer,AURIFY,Ho Chi Minh,hybrid,"Information Security, ISO 27001, Cloud Security, PCI DSS",5 years,,,
Cyber Security Consultant,Capgemini Vietnam,Ho Chi Minh,onsite,"Cybersecurity, Governance, Risk & Compliance",5+ years,,,
"Data Analyst (Power BI, SQL, BI Developer, BA)",Tổng công ty Tân Cảng Sài Gòn (Saigon NewPort Corporation),Ho Chi Minh,onsite,"Data Analysis, Business Intelligence, Power BI, Data modeling",1 years,,,
AI Workflow Engineer (Node.js / AI Automation),AiClipX,Ho Chi Minh,remote,"NodeJS, Docker, Python, Automation Test, Redis",,,,
Website Product Manager,Nakivo,Ho Chi Minh,onsite,"Product Management, Business Analysis, English",3+ years,,,
Web Developer (PHP & JavaScript),Deliveree On-Demand Logistics,Ho Chi Minh,hybrid,"PHP, JavaScript, UI-UX, Wordpress, CSS, English",1+ years,,,
Manual Tester (QA QC),DeliGroup,Ho Chi Minh,onsite,"Tester, API, QA QC, SQL",02+ years,,,
Senior AI Engineer (Infrastructure Focus),Bitcoin Builders,Ho Chi Minh,onsite,"PyTorch, Deep Learning, Machine Learning, AI, Docker",,,,
Middle/SeniorCloud Infrastructure Engineer (AWS/Kuber),Ngân hàng TMCP Phương Đông | OCB,Ho Chi Minh,onsite,"AWS, Cloud, Kubernetes",,,,
Middle/Senior Database Administrator (DBA),Ngân hàng TMCP Phương Đông | OCB,Ho Chi Minh,onsite,"Microsoft Azure SQL Database, Microsoft SQL Server, Database",3 years,,,
"Senior QC (Da Nang, Can Tho, Hybrid)",Dirox,Ho Chi Minh,onsite,"QA QC, Database, English",4+ years,,,
"Senior Backend Developer (Java, Golang, SQL, Database)",10X Technology and Consulting,Ho Chi Minh,onsite,"Java, Database, SQL, PostgreSql, MySQL, Golang",5+ years,,,
Senior Product Owner – B2B SaaS (ERP / E-Office),MYMIND,Ho Chi Minh,hybrid,"Product Owner, Product strategy, Product Management",2 years,,,
Security Engineer,CÔNG TY CỔ PHẦN CMC OPENAI,Ha Noi,onsite,"Cloud, Pentest",5 years,,,
Fullstack Dev - AI products,TecAlliance Vietnam,Ho Chi Minh,hybrid,"Fullstack, Cloud Security, NumPy, Pandas, AI, Python",3 years,,,
"Data Engineer (SQL, Agile)",Live Payments,Ho Chi Minh,onsite,"Microsoft SQL Server, Cloud-native Architecture, Python, ETL",,,,
Telecom Business Architect,Huawei,Ha Noi,onsite,"Business Analysis, Data Analysis",7+ years,,,
Cloud Infrastructure Engineer,CÔNG TY CỔ PHẦN NGHIÊN CỨU PHÁT TRIỂN VÀ ỨNG DỤNG NGƯỜI MÁY ĐA NĂNG VINMOTION,Ha Noi,onsite,"CloudFormation, CI/CD, Terraform, AWS",3+ years,,,
"Senior C#/.NET Engineer (ReactJS, English)",HRS Group,Ho Chi Minh,hybrid,".NET, Automation Test, ReactJS, C#, AI, English",6 years,,,
Principal AI/LLM Solution Engineer (Cloud Contract),"MONEY FORWARD VIETNAM CO.,LTD",Ho Chi Minh,hybrid,"AI, LLM, MLOps, Cloud, Python, Golang",2+ years,,,
Senior / Lead AI Engineer (English Speaking),Topicus Vietnam,Ho Chi Minh,hybrid,"Generative AI, English, LLM",,,,
"Automation Tester (Java, Selenium)",CODE88 COMPANY LIMITED,Ho Chi Minh,onsite,"Automation Test, Selenium, Java, Tester, QA QC, English",2 years,,,
"[Middle, Senior] BackEnd Engineer (Java, Go)",MB Bank,Ha Noi,onsite,"Java, Oracle, Golang, Spring Boot, MySQL, AI",02 years,,,
"[Junior, Senior] FullStack Developer",MB Bank,Ha Noi,onsite,"Java, Golang, MongoDB, PostgreSql, Spring Boot, Oracle",,,,
"[Middle, Senior] FullStack Developer",MB Bank,Ha Noi,onsite,"Java, MongoDB, PostgreSql, Microservices, Spring, Oracle",1-2 years,,,
"FullStack Developer (Da Nang, Can Tho, Hybrid)",Dirox,Ho Chi Minh,hybrid,"Java, Angular, ReactJS, English",5+ years,,,
"[Junior, Senior] BackEnd Engineer (Java, Go)",MB Bank,Ha Noi,onsite,"Java, Golang, MongoDB, PostgreSql, Spring Boot, Oracle",,,,
[Telecom] Core Network Engineer,Huawei,Ha Noi,onsite,"Cloud, English",2 years,,,
Cloud Engineer,Huawei,Ha Noi,onsite,"Cloud, English",,,,
"AI Engineer (Generative AI, MLOps, Scikit-learn, Azure)",FPT Digital,Ho Chi Minh,onsite,"Python, AWS CloudFormation, MLOps, LLM, scikit-learn",,,,
"Data Engineer (Python, PowerBI, SnowFlake, DataBrick)",FPT Digital,Ho Chi Minh,onsite,"Data Engineer, Databricks, Snowflake, Python, SQL",3+ years,,,
"Scrum Master (Scrum, Kanban, PSM I/CSM, Cloud, Azure)",FPT Digital,Ho Chi Minh,onsite,"Project Management, MLOps, Azure, Kanban, Scrum",4 years,,,
Middle/Senior Oracle & .NET Backend,CÔNG TY TNHH SẢN XUẤT VINH QUANG,Ha Noi,onsite,"C#, Oracle, SQL, .Net Core, Database, .NET",5 years,,,
Senior Java Developer (Spring/OOP),Nakivo,Ho Chi Minh,onsite,"Java, OOP, Spring",5 years,,,
Manual QA Engineer (QA QC/Tester/English),Nakivo,Ho Chi Minh,onsite,"QA QC, Networking, Linux, Tester, Cloud, English",3+ years,,,
"Backend Developer (Java, Spring Boot, Web3)",Pinetree Securities,Ha Noi,onsite,"Java, Blockchain, Design Systems, Kafka, Microservices",4-8 years,,,
"Full-Stack Developer (Typescript, C++, DAP, LSP)",LG Electronics Development Vietnam (LGEDV),Ha Noi,hybrid,"TypeScript, Linux, JavaScript, C++, DApps, API",5+ years,,,
"Site Reliability Engineer (SRE, AWS, Azure, Cloud)",Pizza Hut Digital & Technology,Ho Chi Minh,hybrid,"Incident Response, Cloud, DevSecOps, Terraform, AWS",2-3 years,,,
Java Software Engineer,Pizza Hut Digital & Technology,Ho Chi Minh,hybrid,"Java, Event-Driven Architecture, API, SQL, Spring Boot",,,,
Bridge Engineer (BrSE/Japanese/Project Manager/.NET/C#),IVS,Ho Chi Minh,onsite,"Bridge Engineer, .NET, C#, Japanese, Project Management",2 years,,,
Senior Business Analyst,New Ocean IS,Ho Chi Minh,onsite,"Business Analysis, Prototyping, Stakeholder management, UML",04 years,,,
Senior ReactJS Developer,SSTech,Ho Chi Minh,onsite,"ReactJS, HTML5, English",4 years,,,
SAP ABAP/BTP Expert,CÔNG TY TNHH ABEAM CONSULTING (VIỆT NAM),Ho Chi Minh - Da Nang,hybrid,"SAP, OOP, ERP, English",10+ years,,,
